{
  "id": "sw2d-foundation-slice",
  "displayName": "SW2D Foundation Slice",
  "version": "0.1.0",
  "schemaVersion": 1,
  "viewport": { "width": 960, "height": 540 },
  "bindings": {},
  "systemPacks": [{ "packId": "starter.placeholder-mover", "config": {} }],
  "defaultSettings": {
    "masterVolume": 0.7
  }
}
