{
  "id": "proof-auto-battler",
  "displayName": "Proof Auto Battler",
  "version": "0.1.0",
  "schemaVersion": 1,
  "viewport": {
    "width": 960,
    "height": 540
  },
  "bindings": {},
  "systemPacks": [
    {
      "packId": "sw2d.strategy",
      "config": {}
    },
    {
      "packId": "sw2d.combat",
      "config": {}
    },
    {
      "packId": "sw2d.ai",
      "config": {}
    },
    {
      "packId": "sw2d.targeting",
      "config": {}
    },
    {
      "packId": "game.ui-simulation-shell",
      "config": {}
    }
  ],
  "defaultSettings": {
    "masterVolume": 0.7
  }
}
