{
  "id": "proof-investigation-game",
  "displayName": "Proof Investigation Game",
  "version": "0.1.0",
  "schemaVersion": 1,
  "viewport": {
    "width": 960,
    "height": 540
  },
  "bindings": {},
  "systemPacks": [
    {
      "packId": "sw2d.narrative",
      "config": {}
    },
    {
      "packId": "sw2d.world",
      "config": {}
    },
    {
      "packId": "sw2d.world-entities",
      "config": {}
    },
    {
      "packId": "sw2d.codex",
      "config": {}
    },
    {
      "packId": "game.top-down-shell",
      "config": {}
    }
  ],
  "defaultSettings": {
    "masterVolume": 0.7
  }
}
