{
  "id": "proof-reaction-timing",
  "displayName": "Proof Reaction Timing",
  "version": "0.1.0",
  "schemaVersion": 1,
  "viewport": {
    "width": 960,
    "height": 540
  },
  "bindings": {},
  "systemPacks": [
    {
      "packId": "sw2d.arcade",
      "config": {}
    },
    {
      "packId": "sw2d.timing",
      "config": {}
    },
    {
      "packId": "game.ui-simulation-shell",
      "config": {}
    }
  ],
  "defaultSettings": {
    "masterVolume": 0.7
  }
}
